{
  "format": 1,
  "name": "Daylight",
  "author": "KaneegaBell",
  "version": "1.0",
  "minAppVersion": "0.3.11",
  "scheme": "light",
  "radius": 10,
  "focusLook": "ring",
  "icon": "daylight",
  "colors": {
    "bg": "#eef0f3", "bg-raised": "#ffffff", "bg-sunken": "#e2e5ea",
    "surface": "#ffffff", "surface-hover": "#f3f5f8", "border": "#cfd4dc",
    "text": "#14171c", "text-dim": "#4b5260", "text-faint": "#6b7280",
    "accent": "#2c63d8", "accent-strong": "#1d4fb8", "on-accent": "#ffffff",
    "focus": "#c76a00", "gold": "#8f6a00", "danger": "#c9362b", "ok": "#1f8a4c"
  }
}
